<!ENTITY doctable SYSTEM "doctable.xml">
<!ENTITY peopletable SYSTEM "peopletable.xml">
<!ENTITY dictionary SYSTEM "dictionary.xml">
<!ENTITY  % style.class	"b|box|brite|c|codenote|comment|e|i|path">
<!ENTITY  % link.class	"uri|mail">
<!ENTITY  % logic.class	"figure|fig|img|br|note|impo|warn|pre|p|table|ul|ol">
<!ENTITY  % all.class	"%logic.class;|%style.class;|%link.class;">

<!ENTITY half   "&#x00BD;"> <!-- VULGAR FRACTION ONE HALF -->
<!ENTITY frac12 "&#x00BD;"> <!-- VULGAR FRACTION ONE HALF -->
<!ENTITY frac14 "&#x00BC;"> <!-- VULGAR FRACTION ONE QUARTER -->
<!ENTITY frac34 "&#x00BE;"> <!-- VULGAR FRACTION THREE QUARTERS -->
<!ENTITY frac18 "&#x215B;"> <!--  -->
<!ENTITY frac38 "&#x215C;"> <!--  -->
<!ENTITY frac58 "&#x215D;"> <!--  -->
<!ENTITY frac78 "&#x215E;"> <!--  -->
<!ENTITY sup1   "&#x00B9;"> <!-- SUPERSCRIPT ONE -->
<!ENTITY sup2   "&#x00B2;"> <!-- SUPERSCRIPT TWO -->
<!ENTITY sup3   "&#x00B3;"> <!-- SUPERSCRIPT THREE -->
<!ENTITY plus   "&#x002B;"> <!-- PLUS SIGN -->
<!ENTITY plusmn "&#x00B1;"> <!-- PLUS-MINUS SIGN -->
<!ENTITY lt     "&#38;#60;"> <!-- LESS-THAN SIGN -->
<!ENTITY equals "&#x003D;"> <!-- EQUALS SIGN -->
<!ENTITY gt     "&#x003E;"> <!-- GREATER-THAN SIGN -->
<!ENTITY divide "&#x00F7;"> <!-- DIVISION SIGN -->
<!ENTITY times  "&#x00D7;"> <!-- MULTIPLICATION SIGN -->
<!ENTITY curren "&#x00A4;"> <!-- CURRENCY SIGN -->
<!ENTITY pound  "&#x00A3;"> <!-- POUND SIGN -->
<!ENTITY dollar "&#x0024;"> <!-- DOLLAR SIGN -->
<!ENTITY cent   "&#x00A2;"> <!-- CENT SIGN -->
<!ENTITY yen    "&#x00A5;"> <!-- YEN SIGN -->
<!ENTITY num    "&#x0023;"> <!-- NUMBER SIGN -->
<!ENTITY percnt "&#x0025;"> <!-- PERCENT SIGN -->
<!ENTITY amp    "&#38;#38;"> <!-- AMPERSAND -->
<!ENTITY ast    "&#x2217;"> <!-- ASTERISK OPERATOR -->
<!ENTITY commat "&#x0040;"> <!-- COMMERCIAL AT -->
<!ENTITY lsqb   "&#x005B;"> <!-- LEFT SQUARE BRACKET -->
<!ENTITY bsol   "&#x005C;"> <!-- REVERSE SOLIDUS -->
<!ENTITY rsqb   "&#x005D;"> <!-- RIGHT SQUARE BRACKET -->
<!ENTITY lcub   "&#x007B;"> <!-- LEFT CURLY BRACKET -->
<!ENTITY horbar "&#x2015;"> <!-- HORIZONTAL BAR -->
<!ENTITY verbar "&#x007C;"> <!-- VERTICAL LINE -->
<!ENTITY rcub   "&#x007D;"> <!-- RIGHT CURLY BRACKET -->
<!ENTITY micro  "&#x00B5;"> <!-- MICRO SIGN -->
<!ENTITY ohm    "&#x2126;"> <!-- OHM SIGN -->
<!ENTITY deg    "&#x00B0;"> <!-- DEGREE SIGN -->
<!ENTITY ordm   "&#x00BA;"> <!-- MASCULINE ORDINAL INDICATOR -->
<!ENTITY ordf   "&#x00AA;"> <!-- FEMININE ORDINAL INDICATOR -->
<!ENTITY sect   "&#x00A7;"> <!-- SECTION SIGN -->
<!ENTITY para   "&#x00B6;"> <!-- PILCROW SIGN -->
<!ENTITY middot "&#x00B7;"> <!-- MIDDLE DOT -->
<!ENTITY larr   "&#x2190;"> <!-- LEFTWARDS DOUBLE ARROW -->
<!ENTITY rarr   "&#x2192;"> <!-- RIGHTWARDS DOUBLE ARROW -->
<!ENTITY uarr   "&#x2191;"> <!-- UPWARDS ARROW -->
<!ENTITY darr   "&#x2193;"> <!-- DOWNWARDS ARROW -->
<!ENTITY copy   "&#x00A9;"> <!-- COPYRIGHT SIGN -->
<!ENTITY reg    "&#x00AE;"> <!-- REG TRADE MARK SIGN -->
<!ENTITY trade  "&#x2122;"> <!-- TRADE MARK SIGN -->
<!ENTITY brvbar "&#x00A6;"> <!-- BROKEN BAR -->
<!ENTITY not    "&#x00AC;"> <!-- NOT SIGN -->
<!ENTITY sung   "&#x2669;"> <!--  -->
<!ENTITY excl   "&#x0021;"> <!-- EXCLAMATION MARK -->
<!ENTITY iexcl  "&#x00A1;"> <!-- INVERTED EXCLAMATION MARK -->
<!ENTITY quot   "&#x0022;"> <!-- QUOTATION MARK -->
<!ENTITY apos   "&#x0027;"> <!-- APOSTROPHE -->
<!ENTITY lpar   "&#x0028;"> <!-- LEFT PARENTHESIS -->
<!ENTITY rpar   "&#x0029;"> <!-- RIGHT PARENTHESIS -->
<!ENTITY comma  "&#x002C;"> <!-- COMMA -->
<!ENTITY lowbar "&#x005F;"> <!-- LOW LINE -->
<!ENTITY hyphen "&#xE4F8;"> <!--  -->
<!ENTITY period "&#x002E;"> <!-- FULL STOP -->
<!ENTITY sol    "&#x002F;"> <!-- SOLIDUS -->
<!ENTITY colon  "&#x003A;"> <!-- COLON -->
<!ENTITY semi   "&#x003B;"> <!-- SEMICOLON -->
<!ENTITY quest  "&#x003F;"> <!-- QUESTION MARK -->
<!ENTITY iquest "&#x00BF;"> <!-- INVERTED QUESTION MARK -->
<!ENTITY laquo  "&#x00AB;"> <!-- LEFT-POINTING DOUBLE ANGLE QUOTATION MARK -->
<!ENTITY raquo  "&#x00BB;"> <!-- RIGHT-POINTING DOUBLE ANGLE QUOTATION MARK -->
<!ENTITY lsquo  "&#x2018;"> <!--  -->
<!ENTITY rsquo  "&#x2019;"> <!-- RIGHT SINGLE QUOTATION MARK -->
<!ENTITY ldquo  "&#x201C;"> <!--  -->
<!ENTITY rdquo  "&#x201D;"> <!-- RIGHT DOUBLE QUOTATION MARK -->
<!ENTITY nbsp   "&#x00A0;"> <!-- NO-BREAK SPACE -->
<!ENTITY shy    "&#x00AD;"> <!-- SOFT HYPHEN -->

<!ELEMENT guide			(title, subtitle?, author+, abstract, license?, version, date, newsitems?, chapter+)>
<!ATTLIST guide			type (project) #IMPLIED
						link CDATA #IMPLIED
						mainpage (yes|no) "no"
						mainid (news|about|contract|packages|graphics|articles|docs|changelog|projects) #IMPLIED>
<!ELEMENT newsitems		(news+)>
<!ELEMENT news			(poster, date, title, body)>
<!ATTLIST news			gentoo (yes|no) "no"
						category (gentoo|main|ibm|linux|moo|nvidia) #REQUIRED>
<!ELEMENT title			(#PCDATA|%style.class;)*>
<!ELEMENT subtitle		(#PCDATA)>
<!ELEMENT author		(#PCDATA|mail)*>
<!ATTLIST author		title CDATA #IMPLIED>
<!ELEMENT abstract		(#PCDATA)>
<!ELEMENT license		EMPTY>
<!ELEMENT version		(#PCDATA)>
<!ELEMENT date			(#PCDATA)>
<!ELEMENT chapter		(title, section+)>
<!ATTLIST chapter   id CDATA #IMPLIED>
<!ELEMENT section		(title?, body)>
<!ATTLIST section   id CDATA #IMPLIED>
<!ELEMENT body			(%all.class;)*>
<!ELEMENT figure		EMPTY>
<!ATTLIST figure		caption CDATA #IMPLIED
						short CDATA #IMPLIED
						link CDATA #REQUIRED>
<!ELEMENT fig			EMPTY>
<!ATTLIST fig			short CDATA #IMPLIED
						linkto CDATA #IMPLIED
						link CDATA #REQUIRED>
<!ELEMENT img			EMPTY>
<!ATTLIST img			src CDATA #REQUIRED>
<!ELEMENT br			(#PCDATA)>
<!ELEMENT note			(#PCDATA|%all.class;)*>
<!ELEMENT impo			(#PCDATA|%all.class;)*>
<!ELEMENT warn			(#PCDATA|%all.class;)*>
<!ELEMENT pre			(#PCDATA|%all.class;)*>
<!ATTLIST pre			caption CDATA #IMPLIED>
<!ELEMENT p				(#PCDATA|%all.class;)*>
<!ELEMENT table			(tcolumn*, tr+)>
<!ELEMENT tcolumn		EMPTY>
<!ATTLIST tcolumn		width CDATA #REQUIRED>
<!ELEMENT tr			(th+|ti+)>
<!ELEMENT th			(#PCDATA|%all.class;)*>
<!ELEMENT ti			(#PCDATA|%all.class;)*>
<!ELEMENT ul			(li+)>
<!ELEMENT ol			(li+)>
<!ELEMENT li			(#PCDATA|%all.class;)*>

<!--STYLE TAGS-->
<!ELEMENT b				(#PCDATA|%style.class;|%link.class;)*>
<!ELEMENT brite			(#PCDATA|%style.class;|%link.class;)*>
<!ELEMENT box			(#PCDATA|%style.class;|%link.class;)*>
<!ELEMENT c				(#PCDATA|%style.class;|%link.class;)*>
<!ELEMENT codenote		(#PCDATA|%style.class;|%link.class;)*>
<!ELEMENT comment		(#PCDATA|%style.class;|%link.class;)*>
<!ELEMENT e				(#PCDATA|%style.class;|%link.class;)*>
<!ELEMENT i				(#PCDATA|%style.class;|%link.class;)*>
<!ELEMENT path			(#PCDATA|%style.class;|%link.class;)*>

<!--LINK TAGS-->
<!ELEMENT mail			(#PCDATA|%style.class;)*>
<!ATTLIST mail			link CDATA #REQUIRED>
<!ELEMENT uri			(#PCDATA|%style.class;)*>
<!ATTLIST uri			link CDATA #IMPLIED>
