<?xml version='1.0' encoding="UTF-8"?>
<!-- $Id: test.xml,v 1.6 2007/05/14 20:49:32 rane Exp $ -->
<!DOCTYPE guide SYSTEM "/dtd/guide.dtd">

<guide link="/doc/en/test.xml">
<title>Testfile</title>

<author title="Author">
  <mail link="pylon@gentoo.org">Lars Weiler</mail>
</author>

<abstract>
This is a testfile with some guidexml content. The main purpose is to test our
DTD checker on the CVS server.         a a
</abstract>

<license />

<version>1.74</version>
<date>2007-03-08</date>

<chapter>
<title>Sample Chapter 1</title>
<section>
<title>Sample Section 1</title>
<body>

<p>
Some text.
Some more text.
</p>

</body>
</section>
<section>
<title>Sample Section 2</title>
<body>

<p>
<b>Some bold text</b> and <e>emphasised</e>.
</p>

<p>
Testing gentoo-doc-cvs mailing list.
</p>

</body>
</section>
</chapter>

</guide>
