<?xml version="1.0" encoding="UTF-8"?>
<!DOCTYPE guide SYSTEM "/dtd/guide.dtd">
<!-- $Header: /var/cvsroot/gentoo/xml/htdocs/proj/pl/desktop/gnome/howtos/gnome-2.16-upgrade.xml,v 1.2 2007/04/05 18:49:17 shadoww Exp $ -->

<guide link="/proj/pl/desktop/gnome/howtos/gnome-2.16-upgrade.xml">

<title>Aktualizacja Gnome do wersji 2.16</title>
<author title="Autor">
  <mail link="dang@gentoo.org">Daniel Gryniewicz</mail>
</author>
<author title="Tłumaczenie">
  <mail link="dawid.weglinski@gmail.com">Dawid Węgliński</mail>
</author>

<abstract>
W przewodniku tym opisano jak należy dokonać aktualizacji GNOME 2.14.x do
2.16.x.
</abstract>

<!-- The content of this document is licensed under the CC-BY-SA license -->
<!-- See http://creativecommons.org/licenses/by-sa/2.5 -->
<license/>

<version>1.0</version>
<date>2006-09-08</date>

<chapter>
<title>Rozwiązywanie problemów</title>
<section>
<title>Znane błędy budowy</title>
<body>

<p>
<c>libnotify</c> buduje różnie na bazie zainstalowanej w systemie wersji GTK+.
Jeśli wystąpiły problemy podczas budowy na przykład <c>zenity</c> lub
<c>rhythmbox</c>, które nie powiodły się z niezdefiniowanym odwołaniem do
powiadomienia funkcji, należy przebudować <c>libnotify</c> po aktualizacji GTK+
do wersji 2.10.x.
</p>

</body>
</section>
<section>
<title>gnome-settings-daemon zawodzi podczas uruchamiania</title>
<body>

<p>
<c>gnome-settings-daemon</c> do działania  wymaga lokalnej sesji dbus. Jego
uruchomienie zawodzi zatem, jeśli sesja nie jest obecna. Sesja Gnome
<c>gnome-session</c> zwykle automatycznie uruchamia sesję dbus. Nie jest to
regułą, kiedy używa się innego Menadżera Okien (WM) lub też polecenia
<c>startx</c> z plikiem <path>~/.xinitrc</path>. W takim przypadku należy
ręcznie uruchomić sesję dbus, dodając następującą linijkę do pliku
uruchamiającego X (<path>~/.xinit</path> dla <c>startx</c>,
<path>~/.xsession</path> dla Menadżera Logowania):
</p>

<pre caption="Uruchamianie sesji dbus">
eval `dbus-launch --exit-with-session --sh-syntax`
</pre>

<p>
Należy się upewnić, że powyższy skrypt został dopisany powyżej linii
<c>gnome-settings-daemon</c>.
</p>

<p>
Alternatywnie, przy użyciu startx i bez specjalnych ustawień w .xinitrc, możliwe
jest usunięcie <path>~/.xinitrc</path> i ustawienie zmiennej XSESSION="gnome" w
pliku <path>~/.profile</path> lub <path>/etc/rc.conf</path>. To poprawnie
uruchomi sesję dbus zanim zostanie uruchomiona sesja gnome.
</p>

</body>
</section>
<section>
<title>Dostawca IMAP 4rev1 nie jest dostępny w Evolution</title>
<body>

<p>
Dostawca IMAP 4rev1 został usunięty z <c>evolution</c> w tej wersji, ponieważ
jest uszkodzony i niewspierany. Użytkownicy powinni zmienić swoje konta, aby
używały normalnego dostawcy IMAP.
</p>

</body>
</section>
</chapter>
</guide>
